{
  "task_id": "ratchet-lane-a-variables-reporting",
  "title": "Ratchet lane A variables reporting",
  "owner": "Copilot",
  "stage": "executor",
  "branch": "ai/task-ratchet-lane-a-variables-reporting",
  "worktree": "../SattLint-ai-ratchet-lane-a-variables-reporting",
  "summary": "Type-clean the lane A variable-reporting surfaces, extract report helpers, split oversized analyzer-variable tests, and prove the owned analyzer/reporting slice with focused pytest, pyright, and coverage.",
  "files": [
    "src/sattlint/analyzers/_variables_execution.py",
    "src/sattlint/analyzers/registry.py",
    "src/sattlint/analyzers/variable_issue_collection.py",
    "src/sattlint/reporting/variables_report.py",
    "src/sattlint/reporting/_variables_report_rendering.py",
    "tests/test_analyzers_state.py",
    "tests/test_analyzers_suites.py",
    "tests/test_analyzers_variables.py",
    "tests/_analyzers_variables_adjacent_analyzers.py"
  ],
  "acceptance_criteria": [],
  "risks": [
    "The shared coordination lock file at .git/sattlint-ai-coordination/current_work_lock.json is currently 0 bytes, so bootstrap or claim updates remain unsafe until the lock state is repaired."
  ],
  "validation": [
    "& \".venv/Scripts/python.exe\" -m pytest --no-cov tests/test_analyzers_state.py tests/test_analyzers_suites.py tests/test_analyzers_variables.py -x -q --tb=short",
    "& \".venv/Scripts/python.exe\" -m pyright src/sattlint/analyzers/_variables_execution.py src/sattlint/analyzers/registry.py src/sattlint/analyzers/variable_issue_collection.py src/sattlint/reporting/variables_report.py",
    "& \".venv/Scripts/python.exe\" -m pytest tests/test_analyzers_state.py tests/test_analyzers_suites.py tests/test_analyzers_variables.py -x -q --tb=short --cov=src/sattlint/analyzers/_variables_execution.py --cov=src/sattlint/analyzers/registry.py --cov=src/sattlint/analyzers/variable_issue_collection.py --cov=src/sattlint/reporting/variables_report.py --cov-report=term-missing --cov-report=xml:artifacts/audit/coverage-lane-a-variables-reporting.xml --cov-fail-under=0",
    "& \".venv/Scripts/python.exe\" -m ruff check src/sattlint/reporting/variables_report.py src/sattlint/reporting/_variables_report_rendering.py tests/test_analyzers_state.py tests/test_analyzers_suites.py tests/test_analyzers_variables.py tests/_analyzers_variables_adjacent_analyzers.py",
    "& \".venv/Scripts/python.exe\" -m pyright src/sattlint/reporting/variables_report.py src/sattlint/reporting/_variables_report_rendering.py tests/test_analyzers_state.py tests/test_analyzers_suites.py tests/test_analyzers_variables.py tests/_analyzers_variables_adjacent_analyzers.py"
  ],
  "status": "validated",
  "handoff_path": ".ai/handoffs/ratchet-lane-a-variables-reporting.json"
}
